axis,grade,evidence,gap_closed
novelty,strong,VLA semantic affordance over-selection plus TailGuard gates,not a generic score-tail wrapper
soundness,strong,"tie-aware finite law, exact/MC checks, claim audits",math tied to fixed candidate pools
empirical rigor,strong,"learned, PyTorch, rendered, noisy, phase, calibration, physics stress",failure modes are adversarial teachers
baselines,strong,"N=1, random, verifier, certificate-only, no-bound, no-fallback, oracle",high-N is not credited without fair comparisons
scope clarity,strong,"external boundary table, no real-robot validation, no physical success",benchmark/status distinction is repeated
reproducibility,strong,"cached artifacts, scripts, manifests, source map, GitHub push",fresh agent can locate source and final PDF
presentation,strong,"v4 scorecard, protocol gates, artifact map, visual QA",reviewer can audit claims without guessing
